{
  "slug": "contact",
  "title": "Contact DeckChair Co. / Contactez DeckChair Co.",
  "description": "Get in touch with DeckChair Co. for orders, trade enquiries, or any questions — in English or French. / Contactez DeckChair Co. pour vos commandes, demandes professionnelles ou toute question — en anglais ou en français.",
  "sections": [
    {
      "id": "hero-contact",
      "component": "Hero",
      "variant": "full-bleed",
      "content": {
        "heading": "We'd love to hear from you / Nous serions ravis de vous entendre",
        "subheading": "Whether you have a question about our collection, need help choosing, or want to discuss a trade order — reach out in English or French and we will respond within one business day. / Que vous ayez une question sur notre collection, besoin d'aide pour choisir ou souhaitiez discuter d'une commande professionnelle — contactez-nous en anglais ou en français.",
        "cta": {
          "label": "Send a message / Envoyer un message",
          "href": "mailto:hello@deckchairco.eu"
        }
      },
      "settings": {
        "spacing": "normal",
        "background": "accent",
        "maxWidth": "wide"
      }
    },
    {
      "id": "contact-form",
      "component": "ContactForm",
      "variant": "simple",
      "content": {
        "heading": "Send us a message / Envoyez-nous un message",
        "description": "Tell us about your order, your outdoor space, or your trade enquiry — we reply in English or French. / Parlez-nous de votre commande, de votre espace extérieur ou de votre demande professionnelle — nous répondons en anglais ou en français.",
        "submitLabel": "Send message / Envoyer",
        "nameLabel": "Name / Nom",
        "emailLabel": "Email",
        "messageLabel": "How can we help? / Comment pouvons-nous vous aider ?"
      },
      "settings": {
        "maxWidth": "narrow"
      }
    },
    {
      "id": "contact-stats",
      "component": "Stats",
      "variant": "featured",
      "content": {
        "heading": "Our commitment to you / Notre engagement envers vous",
        "items": [
          {
            "label": "Response time / Délai de réponse",
            "value": "24",
            "suffix": " hrs"
          },
          {
            "label": "Languages supported / Langues disponibles",
            "value": "2"
          },
          {
            "label": "Countries we deliver to / Pays de livraison",
            "value": "18",
            "suffix": "+"
          }
        ]
      },
      "settings": {
        "maxWidth": "wide"
      }
    },
    {
      "id": "cta-contact",
      "component": "CTABanner",
      "variant": "with-image",
      "content": {
        "heading": "Prefer to email directly? / Préférez-vous envoyer un e-mail directement ?",
        "subheading": "Our bilingual team is always happy to help — in English or French. / Notre équipe bilingue est toujours disponible pour vous aider — en anglais ou en français.",
        "cta": {
          "label": "Email hello@deckchairco.eu",
          "href": "mailto:hello@deckchairco.eu"
        }
      },
      "settings": {
        "background": "neutral"
      }
    }
  ]
}
