{
  "slug": "home",
  "title": "StormShield Umbrellas — Built to Outlast Any Storm",
  "description": "StormShield makes the world's only umbrellas guaranteed never to collapse — even in cyclone-force winds. Discover our range and find your perfect shield.",
  "sections": [
    {
      "id": "hero-home",
      "component": "Hero",
      "variant": "centered",
      "content": {
        "heading": "The Last Umbrella You'll Ever Need",
        "subheading": "StormShield umbrellas are engineered to stand firm in cyclone-force winds — no collapsing, no inside-out moments, no excuses. Just reliable, beautiful protection, every single time.",
        "cta": {
          "label": "Shop Umbrellas",
          "href": "/services"
        }
      },
      "settings": {
        "spacing": "relaxed",
        "background": "primary",
        "maxWidth": "narrow"
      }
    },
    {
      "id": "features-home",
      "component": "FeatureGrid",
      "variant": "three-column",
      "content": {
        "heading": "Why StormShield Stands Apart",
        "items": [
          {
            "title": "Cyclone-Rated Frame",
            "description": "Our patented AeroLock™ frame is stress-tested to withstand winds exceeding 200 km/h. Where ordinary umbrellas fold, StormShield holds steady."
          },
          {
            "title": "Zero-Collapse Guarantee",
            "description": "Every StormShield comes with our lifetime Zero-Collapse Guarantee. If it ever inverts or collapses in any weather condition, we replace it — no questions asked."
          },
          {
            "title": "Featherlight Strength",
            "description": "Advanced aerospace-grade aluminium and fibreglass ribs give you maximum strength at minimum weight. Carry it all day without a second thought."
          },
          {
            "title": "All-Weather Canopy",
            "description": "Our UV-blocking, water-repellent canopy sheds rain instantly and protects against harsh sun — so you're covered in every sense of the word."
          },
          {
            "title": "Ergonomic Comfort Grip",
            "description": "A contoured, non-slip handle means a secure, comfortable hold even in the wettest, windiest conditions. Your hand won't tire, and the umbrella won't slip."
          },
          {
            "title": "Thoughtfully Designed",
            "description": "Elegant colour options and a compact carry sleeve mean StormShield looks as good as it performs — from the morning commute to a weekend adventure."
          }
        ]
      },
      "settings": {
        "maxWidth": "wide"
      }
    },
    {
      "id": "benefits-home",
      "component": "Stats",
      "variant": "counter-row",
      "content": {
        "heading": "Built on Proof, Not Promises",
        "items": [
          {
            "label": "Maximum wind speed tested",
            "value": "200",
            "suffix": " km/h"
          },
          {
            "label": "Umbrellas sold worldwide",
            "value": "50,000",
            "suffix": "+"
          },
          {
            "label": "Collapse incidents reported",
            "value": "0"
          },
          {
            "label": "Customer satisfaction",
            "value": "99",
            "suffix": "%"
          }
        ]
      },
      "settings": {
        "maxWidth": "wide",
        "background": "neutral"
      }
    },
    {
      "id": "pricing-home",
      "component": "PricingTable",
      "variant": "tier-cards",
      "content": {
        "heading": "Simple, Transparent Pricing",
        "tiers": [
          {
            "name": "Everyday Shield",
            "price": "$89",
            "currency": "USD",
            "features": [
              "AeroLock™ cyclone-rated frame",
              "Zero-Collapse Guarantee",
              "UV-blocking canopy",
              "Compact carry sleeve",
              "Perfect for daily commuters"
            ],
            "cta": {
              "label": "Buy Now",
              "href": "/contact"
            }
          },
          {
            "name": "Storm Pro",
            "price": "$149",
            "currency": "USD",
            "features": [
              "Everything in Everyday Shield",
              "Extra-wide 130 cm canopy",
              "Premium ergonomic comfort grip",
              "Reinforced double-layer canopy",
              "Ideal for frequent travellers"
            ],
            "cta": {
              "label": "Buy Now",
              "href": "/contact"
            }
          },
          {
            "name": "Cyclone Elite",
            "price": "$229",
            "currency": "USD",
            "features": [
              "Everything in Storm Pro",
              "Aerospace-grade titanium frame",
              "Lifetime free replacement promise",
              "Custom colour & monogram options",
              "Priority customer support",
              "The ultimate all-weather companion"
            ],
            "cta": {
              "label": "Buy Now",
              "href": "/contact"
            }
          }
        ]
      },
      "settings": {
        "maxWidth": "wide"
      }
    },
    {
      "id": "testimonials-home",
      "component": "Testimonials",
      "variant": "cards",
      "content": {
        "heading": "Trusted Through Every Storm",
        "items": [
          {
            "quote": "I was caught in a tropical storm in Thailand and my StormShield didn't budge. Every other umbrella around me was destroyed. I'm a customer for life.",
            "author": "Rachel T.",
            "role": "Verified Buyer"
          },
          {
            "quote": "I've gone through dozens of umbrellas over the years. StormShield is the first one that actually does what it says. Worth every cent.",
            "author": "Marcus L.",
            "role": "Storm Pro Owner"
          },
          {
            "quote": "The Cyclone Elite is genuinely beautiful and genuinely indestructible. I've recommended it to everyone I know.",
            "author": "Priya S.",
            "role": "Cyclone Elite Owner"
          }
        ]
      },
      "settings": {
        "maxWidth": "wide"
      }
    },
    {
      "id": "cta-home",
      "component": "CTABanner",
      "variant": "full-width",
      "content": {
        "heading": "Ready to Never Worry About the Weather Again?",
        "subheading": "Join over 50,000 people who've made the switch to an umbrella that truly holds up — whatever the sky throws at them.",
        "cta": {
          "label": "Shop StormShield",
          "href": "/services"
        }
      },
      "settings": {
        "background": "accent"
      }
    },
    {
      "id": "faq-home",
      "component": "FAQAccordion",
      "variant": "simple",
      "content": {
        "heading": "Your Questions, Answered",
        "faqs": [
          {
            "question": "What makes StormShield umbrellas different from regular umbrellas?",
            "answer": "StormShield umbrellas are built around our patented AeroLock™ frame — a system of aerospace-grade ribs and a reinforced hub that distributes wind force evenly across the canopy instead of concentrating it at weak points. This is what allows our umbrellas to withstand cyclone-force winds that would destroy a conventional umbrella in seconds."
          },
          {
            "question": "What does the Zero-Collapse Guarantee actually cover?",
            "answer": "It covers exactly what it says: if your StormShield umbrella ever collapses or inverts under any weather condition during normal use, we will replace it free of charge. No receipts, no fuss — just contact our support team and we'll sort it out promptly."
          },
          {
            "question": "How heavy is a StormShield umbrella?",
            "answer": "Despite their strength, our umbrellas are surprisingly light. The Everyday Shield weighs just 380 g, the Storm Pro 420 g, and the Cyclone Elite 390 g thanks to its titanium frame. You'll barely notice it in your bag."
          },
          {
            "question": "Which model is right for me?",
            "answer": "If you want reliable everyday protection at a great price, the Everyday Shield is a wonderful starting point. Frequent travellers or those in particularly stormy climates tend to love the Storm Pro's wider canopy and reinforced double-layer design. If you want the absolute best — and a truly personalised umbrella — the Cyclone Elite is our flagship and comes with a lifetime free replacement promise."
          },
          {
            "question": "Do you ship internationally?",
            "answer": "Yes — we ship to over 60 countries worldwide. Shipping times and costs vary by destination; full details are available at checkout. We think everyone deserves an umbrella that won't let them down, wherever they are in the world."
          }
        ]
      },
      "settings": {
        "maxWidth": "narrow",
        "spacing": "relaxed"
      }
    }
  ]
}
